{
  "format": "rocklog.program",
  "schemaVersion": 1,
  "exportedAt": "2026-08-30T00:00:00Z",
  "block": {
    "id": "14fbcd3f-1a51-56e7-bbf9-24b67417f2d8",
    "name": "Demo 8-Week Running Split",
    "notes": "Synthetic demo. Running 3-day split (Lower / Push / Pull) trained 4 days a week on the dates in the file (starts Monday 2026-08-31). Does not reset Monday. Lower A is Conventional Deadlift; the next Lower is Romanian Deadlift. Fake lifts and weights only.",
    "startDate": "2026-08-31",
    "sessions": [
      {
        "id": "c9751495-7644-5d02-859e-09f45f4fab24",
        "date": "2026-08-31",
        "dayType": "Lower",
        "exercises": [
          {
            "id": "3e2b9f22-50bb-5b91-818c-59ec2dfff7ad",
            "name": "Conventional Deadlift",
            "muscleGroup": "Hamstrings, Glutes, Lower Back, Back",
            "trainingMode": "Strength",
            "sets": [
              {
                "setNumber": 1,
                "weightLbs": 135,
                "reps": 5,
                "isWarmup": true
              },
              {
                "setNumber": 2,
                "weightLbs": 185,
                "reps": 3,
                "isWarmup": true
              },
              {
                "setNumber": 3,
                "weightLbs": 225,
                "reps": 5,
                "isWarmup": false
              },
              {
                "setNumber": 4,
                "weightLbs": 225,
                "reps": 5,
                "isWarmup": false
              },
              {
                "setNumber": 5,
                "weightLbs": 225,
                "reps": 5,
                "isWarmup": false
              }
            ]
          },
          {
            "id": "5b649c31-4127-5b2a-be6e-e3bcf8bb5e80",
            "name": "Barbell Back Squat",
            "muscleGroup": "Quads, Glutes, Lower Back",
            "trainingMode": "Strength",
            "sets": [
              {
                "setNumber": 1,
                "weightLbs": 95,
                "reps": 8,
                "isWarmup": true
              },
              {
                "setNumber": 2,
                "weightLbs": 155,
                "reps": 5,
                "isWarmup": false
              },
              {
                "setNumber": 3,
                "weightLbs": 155,
                "reps": 5,
                "isWarmup": false
              },
              {
                "setNumber": 4,
                "weightLbs": 155,
                "reps": 5,
                "isWarmup": false
              }
            ]
          },
          {
            "id": "3da05d6b-bb83-56ec-80a6-355a5f60d599",
            "name": "Leg Press",
            "muscleGroup": "Quads, Glutes",
            "trainingMode": "Strength",
            "sets": [
              {
                "setNumber": 1,
                "weightLbs": 180,
                "reps": 10,
                "isWarmup": false
              },
              {
                "setNumber": 2,
                "weightLbs": 180,
                "reps": 10,
                "isWarmup": false
              },
              {
                "setNumber": 3,
                "weightLbs": 180,
                "reps": 10,
                "isWarmup": false
              }
            ]
          }
        ],
        "rotationTrack": "A"
      },
      {
        "id": "f3d7851f-1774-537a-955d-f322e8baa9d9",
        "date": "2026-09-01",
        "dayType": "Push",
        "exercises": [
          {
            "id": "b06e59e1-7c0d-5892-8000-10a6ae199453",
            "name": "Barbell Bench Press",
            "muscleGroup": "Chest, Triceps, Shoulders",
            "trainingMode": "Strength",
            "sets": [
              {
                "setNumber": 1,
                "weightLbs": 95,
                "reps": 8,
                "isWarmup": true
              },
              {
                "setNumber": 2,
                "weightLbs": 135,
                "reps": 5,
                "isWarmup": true
              },
              {
                "setNumber": 3,
                "weightLbs": 155,
                "reps": 5,
                "isWarmup": false
              },
              {
                "setNumber": 4,
                "weightLbs": 155,
                "reps": 5,
                "isWarmup": false
              },
              {
                "setNumber": 5,
                "weightLbs": 155,
                "reps": 5,
                "isWarmup": false
              }
            ]
          },
          {
            "id": "cb6c9f05-e8a6-5065-a076-5834738d6d5c",
            "name": "Overhead Press",
            "muscleGroup": "Shoulders, Triceps",
            "trainingMode": "Strength",
            "sets": [
              {
                "setNumber": 1,
                "weightLbs": 65,
                "reps": 8,
                "isWarmup": true
              },
              {
                "setNumber": 2,
                "weightLbs": 85,
                "reps": 6,
                "isWarmup": false
              },
              {
                "setNumber": 3,
                "weightLbs": 85,
                "reps": 6,
                "isWarmup": false
              },
              {
                "setNumber": 4,
                "weightLbs": 85,
                "reps": 6,
                "isWarmup": false
              }
            ]
          },
          {
            "id": "bf44c290-d92b-5e8a-9bb5-f76699c2851a",
            "name": "Lateral Raise",
            "muscleGroup": "Shoulders",
            "trainingMode": "Strength",
            "sets": [
              {
                "setNumber": 1,
                "weightLbs": 15,
                "reps": 12,
                "isWarmup": false
              },
              {
                "setNumber": 2,
                "weightLbs": 15,
                "reps": 12,
                "isWarmup": false
              },
              {
                "setNumber": 3,
                "weightLbs": 15,
                "reps": 12,
                "isWarmup": false
              }
            ]
          }
        ]
      },
      {
        "id": "eac46394-f91c-5168-99ca-943e5349f17c",
        "date": "2026-09-03",
        "dayType": "Pull",
        "exercises": [
          {
            "id": "8b2b5278-e6f9-55ce-ae91-921e1e53d8ae",
            "name": "Barbell Bent-Over Row",
            "muscleGroup": "Back, Biceps, Lower Back",
            "trainingMode": "Strength",
            "sets": [
              {
                "setNumber": 1,
                "weightLbs": 95,
                "reps": 8,
                "isWarmup": true
              },
              {
                "setNumber": 2,
                "weightLbs": 135,
                "reps": 8,
                "isWarmup": false
              },
              {
                "setNumber": 3,
                "weightLbs": 135,
                "reps": 8,
                "isWarmup": false
              },
              {
                "setNumber": 4,
                "weightLbs": 135,
                "reps": 8,
                "isWarmup": false
              }
            ]
          },
          {
            "id": "b9d5ccc8-6ad7-58ac-bf66-2ff2def7ef32",
            "name": "Lat Pulldown",
            "muscleGroup": "Back, Biceps",
            "trainingMode": "Strength",
            "sets": [
              {
                "setNumber": 1,
                "weightLbs": 80,
                "reps": 10,
                "isWarmup": false
              },
              {
                "setNumber": 2,
                "weightLbs": 80,
                "reps": 10,
                "isWarmup": false
              },
              {
                "setNumber": 3,
                "weightLbs": 80,
                "reps": 10,
                "isWarmup": false
              }
            ]
          },
          {
            "id": "fda90b97-cf8d-503e-8665-087a738fe0ac",
            "name": "Biceps Curl",
            "muscleGroup": "Biceps",
            "trainingMode": "Strength",
            "sets": [
              {
                "setNumber": 1,
                "weightLbs": 30,
                "reps": 10,
                "isWarmup": false
              },
              {
                "setNumber": 2,
                "weightLbs": 30,
                "reps": 10,
                "isWarmup": false
              },
              {
                "setNumber": 3,
                "weightLbs": 30,
                "reps": 10,
                "isWarmup": false
              }
            ]
          }
        ]
      },
      {
        "id": "915cadd5-b5aa-597f-a906-89f044e960d6",
        "date": "2026-09-04",
        "dayType": "Lower",
        "exercises": [
          {
            "id": "ae4a8f4f-68a0-5aa0-8ca2-2a2d73f470e1",
            "name": "Romanian Deadlift",
            "muscleGroup": "Hamstrings, Glutes, Lower Back",
            "trainingMode": "Strength",
            "sets": [
              {
                "setNumber": 1,
                "weightLbs": 95,
                "reps": 8,
                "isWarmup": true
              },
              {
                "setNumber": 2,
                "weightLbs": 155,
                "reps": 8,
                "isWarmup": false
              },
              {
                "setNumber": 3,
                "weightLbs": 155,
                "reps": 8,
                "isWarmup": false
              },
              {
                "setNumber": 4,
                "weightLbs": 155,
                "reps": 8,
                "isWarmup": false
              }
            ]
          },
          {
            "id": "5b649c31-4127-5b2a-be6e-e3bcf8bb5e80",
            "name": "Barbell Back Squat",
            "muscleGroup": "Quads, Glutes, Lower Back",
            "trainingMode": "Strength",
            "sets": [
              {